Food code;Main food description;Additional food description;WWEIA Category number;WWEIA Category description
27450450;Shrimp creole, no rice;;3006;Seafood mixed dishes
27450470;Kung Pao shrimp;;3404;Stir-fry and soy-based sauce mixtures
27450510;Tuna casserole with vegetables and mushroom sauce, no noodles;;3006;Seafood mixed dishes
27450600;"Shellfish mixture and vegetables including carrots, broccoli, and/or dark-green leafy; no potatoes, soy-based sauce";;3404;Stir-fry and soy-based sauce mixtures
27450610;"Shellfish mixture and vegetables excluding carrots, broccoli, and dark-green leafy; no potatoes, soy-based sauce";;3404;Stir-fry and soy-based sauce mixtures
27450650;"Shellfish mixture and vegetables including carrots, broccoli, and/or dark-green leafy; no potatoes, mushroom sauce";;3006;Seafood mixed dishes
27450660;"Shellfish mixture and vegetables excluding carrots, broccoli, and dark-green leafy; no potatoes, mushroom sauce";;3006;Seafood mixed dishes
27450700;"Fish and vegetables including carrots, broccoli, and/or dark-green leafy; no potatoes, tomato-based sauce";;3006;Seafood mixed dishes
27450710;"Fish and vegetables excluding carrots, broccoli, and dark- green leafy; no potatoes, tomato-based sauce";;3006;Seafood mixed dishes
27450740;"Fish and vegetables including carrots, broccoli, and/or dark-green leafy; no potatoes, soy-based sauce";;3404;Stir-fry and soy-based sauce mixtures
27450750;"Fish and vegetables excluding  carrots, broccoli, and dark-green leafy; no potatoes, soy-based sauce";;3404;Stir-fry and soy-based sauce mixtures
27450760;Fish shish kabob with vegetables, excluding potatoes;;3006;Seafood mixed dishes
27451010;Fried fish with sauce, Puerto Rican style;"Mojo isleno; Pescado frito con mojo";3006;Seafood mixed dishes
27451030;Lobster with sauce, Puerto Rican style;Langosta a la criolla;3006;Seafood mixed dishes
27451060;Octopus salad, Puerto Rican style;Ensalada de pulpo;3006;Seafood mixed dishes
27451070;Codfish salad, Puerto Rican style, Serenata;"oil, vinegar, onion, olives, tomatoes; Gazpacho de bacalao; Bacalao revuelto con huevos; Ensalada de bacalao";3006;Seafood mixed dishes
27460010;Chow mein or chop suey, NS as to type of meat, no noodles;;3402;Fried rice and lo/chow mein
27460100;Lau lau;pork and fish wrapped in taro or spinach leaves;3006;Seafood mixed dishes
27460510;Antipasto with ham, fish, cheese, vegetables;;3002;Meat mixed dishes
27460710;Livers, chicken, chopped, with eggs and onion;;3004;Poultry mixed dishes
27460750;Liver, beef or calves, and onions;;3002;Meat mixed dishes
27462000;Stewed chitterlings, Puerto Rican style;"Cuajito; Cuajo guisado";3002;Meat mixed dishes
27463000;Stewed gizzards, Puerto Rican style;Mollejitas guisadas;3004;Poultry mixed dishes
27464000;Gumbo, no rice;shellfish, pork, poultry, tomatoes, and okra;3006;Seafood mixed dishes
27500050;Sandwich, NFS;;3740;Deli and cured meat sandwiches
27500300;Sandwich wrap, NFS;;3740;Deli and cured meat sandwiches
27500400;Barbecue sandwich, NFS;bbq;3742;Meat and BBQ sandwiches
27510100;Sloppy joe sandwich, on white bun;"on bread or roll; NS as to grain; Manwich";3742;Meat and BBQ sandwiches
27510105;Sloppy joe sandwich, on wheat bun;"on bread or roll; multigrain, whole grain, or whole wheat; Manwich";3742;Meat and BBQ sandwiches
27510130;Barbecue beef sandwich, on white bun;"bbq; on bread or roll; shredded or pulled; NS as to grain";3742;Meat and BBQ sandwiches
27510135;Barbecue beef sandwich, on wheat bun;"bbq; on bread or roll; shredded or pulled; multigrain, whole grain, or whole wheat";3742;Meat and BBQ sandwiches
27510140;Cheeseburger slider, from fast food;"White Castle Cheese Slider; slider";3702;Burgers
27510155;Cheeseburger, NFS;;3702;Burgers
27510160;Cheeseburger, from fast food, 1 small patty;junior patty;3702;Burgers
27510170;Cheeseburger (Burger King);;3702;Burgers
27510171;Whopper Jr with cheese (Burger King);;3702;Burgers
27510172;Cheeseburger (McDonalds);;3702;Burgers
27510190;Cheeseburger, from school cafeteria;"school cheeseburger, nfs; any size patty, excluding miniature; plain or with condiments";3702;Burgers
27510191;Cheeseburger slider;miniature patty;3702;Burgers
27510195;Cheeseburger, on white bun, 1 small patty;"homemade; bun, NFS; junior patty";3702;Burgers
27510196;Cheeseburger, on wheat bun, 1 small patty;"homemade; junior patty";3702;Burgers
27510215;Cheeseburger, from fast food, 1 medium patty;quarter pound patty;3702;Burgers
27510229;Quarter Pounder (McDonalds);;3702;Burgers
27510231;Whopper with cheese (Burger King);;3702;Burgers
27510232;Quarter Pounder with cheese (McDonalds);;3702;Burgers
27510241;Cheeseburger, on white bun, 1 medium patty;"homemade; bun, NFS; quarter pound patty";3702;Burgers
27510242;Cheeseburger, on wheat bun, 1 medium patty;"homemade; wheat bread; quarter pound patty; any amount of cheese slices";3702;Burgers
27510245;Cheeseburger, on white bun, 1 large patty;"on bread or roll; NS as to grain; third pound size patty";3702;Burgers
27510246;Cheeseburger, on wheat bun, 1 large patty;"on bread or roll; multigrain, whole grain or whole wheat; quarter pound or regular size patty";3702;Burgers
27510254;Double cheeseburger, on white bun, 2 small patties;"on bread or roll; NS as to grain; junior or kid's meal size patty";3702;Burgers
27510255;Double cheeseburger, on wheat bun, 2 small patties;"on bread or roll; multigrain, whole grain or whole wheat; junior or kid's meal size patty";3702;Burgers
27510257;Double cheeseburger, on white bun, 2 medium patties;"on bread or roll; NS as to grain; quarter pound or regular size patty";3702;Burgers
27510258;Double cheeseburger, on wheat bun, 2 medium patties;"on bread or roll; multigrain, whole grain or whole wheat; quarter pound or regular size patty";3702;Burgers
27510261;Cheeseburger, from fast food, 1 large patty;one third pound patty;3702;Burgers
27510262;Double cheeseburger, on white bun, 2 large patties;"on bread or roll; NS as to grain; third pound size patty";3702;Burgers
27510263;Double cheeseburger, on wheat bun, 2 large patties;"on bread or roll; multigrain, whole grain or whole wheat; quarter pound or regular size patty";3702;Burgers
27510371;Double cheeseburger, from fast food, 2 small patties;junior patty;3702;Burgers
27510386;Double cheeseburger (Burger King);;3702;Burgers
27510387;Double cheeseburger (McDonalds);;3702;Burgers
27510388;McDouble (McDonalds);;3702;Burgers
27510389;Big Mac (McDonalds);"Mac Jr; Grand Mac";3702;Burgers
27510401;Double cheeseburger, from fast food, 2 medium patties;quarter pound patty;3702;Burgers
27510405;Double cheeseburger, from fast food, 2 large patties;third pound size patty;3702;Burgers
27510501;Hamburger slider, from fast food;"White Castle Original Slider; slider";3702;Burgers
27510521;Hamburger, NFS;;3702;Burgers
27510531;Hamburger, from fast food, 1 small patty;junior patty;3702;Burgers
27510551;Hamburger (Burger King);;3702;Burgers
27510552;Whopper Jr (Burger King);;3702;Burgers
27510553;Hamburger (McDonalds);;3702;Burgers
27510565;Hamburger, from school cafeteria;"school hamburger, nfs; any size patty, excluding miniature; plain or with condiments";3702;Burgers
27510573;Hamburger slider;miniature patty;3702;Burgers
27510575;Hamburger, on white bun, 1 small patty;"homemade; bun, NFS; junior patty";3702;Burgers
27510576;Hamburger, on wheat bun, 1 small patty;"homemade; junior patty";3702;Burgers
27510601;Hamburger, from fast food, 1 medium patty;quarter pound patty;3702;Burgers
27510605;Hamburger, from fast food, 1 large patty;third pound size patty;3702;Burgers
27510615;Whopper (Burger King);;3702;Burgers
27510631;Hamburger, on white bun, 1 medium patty;"homemade; bun, NFS; white and other bread such as potato, Italian, and rye; bread, nfs; quarter pound patty";3702;Burgers
27510632;Hamburger, on wheat bun, 1 medium patty;"homemade; wheat bread; quarter pound patty";3702;Burgers
27510635;Hamburger, on white bun, 1 large patty;"on bread or roll; NS as to grain; third pound size patty";3702;Burgers
27510636;Hamburger, on wheat bun, 1 large patty;"on bread or roll; multigrain, whole grain or whole wheat; quarter pound or regular size patty";3702;Burgers
27510649;Double hamburger, on white bun, 2 small patties;"on bread or roll; NS as to grain; junior or kid's meal size patty";3702;Burgers
27510652;Double hamburger, on wheat bun, 2 small patties;"on bread or roll; multigrain, whole grain or whole wheat; junior or kid's meal size patty";3702;Burgers
27510655;Double hamburger, on white bun, 2 medium patties;"on bread or roll; NS as to grain; quarter pound or regular size patty";3702;Burgers
27510657;Double hamburger, on wheat bun, 2 medium patties;"on bread or roll; multigrain, whole grain or whole wheat; quarter pound or regular size patty";3702;Burgers
27510658;Double hamburger, on white bun, 2 large patties;"on bread or roll; NS as to grain; third pound size patty";3702;Burgers
27510659;Double hamburger, on wheat bun, 2 large patties;"on bread or roll; multigrain, whole grain or whole wheat; quarter pound or regular size patty";3702;Burgers
27510661;Double hamburger, from fast food, 2 small patties;junior patty;3702;Burgers
27510671;Double hamburger, from fast food, 2 medium patties;quarter pound patty;3702;Burgers
27510675;Double hamburger, from fast food, 2 large patties;third pound size patty;3702;Burgers
27510700;Meatball sandwich or sub;;3742;Meat and BBQ sandwiches
27510702;Meatloaf sandwich;;3742;Meat and BBQ sandwiches
27510705;Chiliburger, with or without cheese, on bun;"hamburger with chili; taco burger, any size patty; any source";3702;Burgers
27510910;Corned beef sandwich on white;"bread, bun or roll; pastrami";3740;Deli and cured meat sandwiches
27510920;Corned beef sandwich on white, with cheese;"bread, bun or roll; pastrami";3740;Deli and cured meat sandwiches
27510930;Corned beef sandwich on wheat;"bread, bun or roll; multigrain, whole grain, whole wheat; pastrami";3740;Deli and cured meat sandwiches
27510940;Corned beef sandwich on wheat, with cheese;"bread, bun or roll; multigrain, whole grain, whole wheat; pastrami";3740;Deli and cured meat sandwiches
27510950;Reuben sandwich;;3740;Deli and cured meat sandwiches
27513010;Roast beef sandwich on white;bread, bun or roll;3740;Deli and cured meat sandwiches
27513050;Roast beef sandwich on white, with cheese;bread, bun or roll;3740;Deli and cured meat sandwiches
27513055;Roast beef sandwich on wheat;"bread, bun or roll; multigrain, whole grain, whole wheat";3740;Deli and cured meat sandwiches
27513065;Roast beef sandwich on wheat, with cheese;"bread, bun or roll; multigrain, whole grain, whole wheat";3740;Deli and cured meat sandwiches
27513070;French dip sandwich;roast beef au jus;3740;Deli and cured meat sandwiches
27514010;Steak sandwich or sub on white;bread, bun or roll;3742;Meat and BBQ sandwiches
27514020;Steak sandwich or sub on wheat;"bread, bun or roll; multigrain, whole grain, whole wheat";3742;Meat and BBQ sandwiches
27514030;Cheese steak sandwich or sub on white;bread, bun or roll;3742;Meat and BBQ sandwiches
27514040;Cheese steak sandwich or sub on wheat;"bread, bun or roll; multigrain, whole grain, whole wheat";3742;Meat and BBQ sandwiches
27516010;Gyro sandwich;;3742;Meat and BBQ sandwiches
27517000;Hamburger wrap sandwich, from fast food;"on tortilla; with or without cheese; homemade or other place";3702;Burgers
27520210;Ham sandwich on white;bread, bun or roll;3740;Deli and cured meat sandwiches
27520220;Ham sandwich on white, with cheese;bread, bun or roll;3740;Deli and cured meat sandwiches
27520230;Ham sandwich on wheat;"bread, bun or roll; multigrain, whole grain, whole wheat";3740;Deli and cured meat sandwiches
27520240;Ham sandwich on wheat, with cheese;"bread, bun or roll; multigrain, whole grain, whole wheat";3740;Deli and cured meat sandwiches
27520255;Ham sandwich or sub, restaurant;"fast food; bread, bun or roll";3740;Deli and cured meat sandwiches
27520260;Ham sandwich or sub, with cheese, restaurant;"fast food; bread, bun or roll";3740;Deli and cured meat sandwiches
27520270;Ham sandwich wrap;"tortilla; flatbread; cheese";3740;Deli and cured meat sandwiches
27520340;Ham salad sandwich on white;"bread, bun or roll; cheese";3740;Deli and cured meat sandwiches
27520345;Ham salad sandwich on wheat;"bread, bun or roll; multigrain, whole grain, whole wheat; cheese";3740;Deli and cured meat sandwiches
27520410;Cuban sandwich;;3742;Meat and BBQ sandwiches
27520500;Barbecue rib sandwich;"bbq; McDonald's McRib";3742;Meat and BBQ sandwiches
27520510;Barbecue pork sandwich, on white bun;"bbq; on bread or roll; shredded or pulled; NS as to grain";3742;Meat and BBQ sandwiches
27520515;Barbecue pork sandwich, on wheat bun;"bbq; on bread or roll; shredded or pulled; multigrain, whole grain, or whole wheat";3742;Meat and BBQ sandwiches
27520520;Pork sandwich;bread, bun or roll;3742;Meat and BBQ sandwiches
27520525;Pork sandwich, with cheese;bread, bun or roll;3742;Meat and BBQ sandwiches
27520610;Bacon, lettuce, tomato sandwich on white;"BLT; bread, bun or roll; cheese";3740;Deli and cured meat sandwiches
27520620;Bacon, lettuce, tomato sandwich on wheat;"BLT; bread, bun or roll; multigrain, whole grain, whole wheat; cheese";3740;Deli and cured meat sandwiches
27540010;Turkey sandwich on white;"bread, bun or roll; deli, luncheon, sliced or roasted chicken";3740;Deli and cured meat sandwiches
27540020;Turkey sandwich on white, with cheese;"bread, bun or roll; deli, luncheon, sliced or roasted chicken";3740;Deli and cured meat sandwiches
27540030;Turkey sandwich on wheat;"bread, bun or roll; multigrain, whole grain, whole wheat; deli, luncheon, sliced or roasted chicken";3740;Deli and cured meat sandwiches
27540040;Turkey sandwich on wheat, with cheese;"bread, bun or roll; multigrain, whole grain, whole wheat; deli, luncheon, sliced or roasted chicken";3740;Deli and cured meat sandwiches
27540050;Turkey sandwich or sub, restaurant;"fast food; bread, bun or roll";3740;Deli and cured meat sandwiches
27540060;Turkey sandwich or sub, with cheese, restaurant;"fast food; bread, bun or roll";3740;Deli and cured meat sandwiches
27540070;Turkey sandwich wrap;"tortilla; flatbread; deli, luncheon, sliced or roasted chicken; cheese";3740;Deli and cured meat sandwiches
27540080;Chicken deli sandwich or sub, restaurant;"fast food; bread, bun or roll; luncheon, sliced or roasted chicken";3740;Deli and cured meat sandwiches
27540090;Chicken deli sandwich or sub, with cheese, restaurant;"fast food; bread, bun or roll; luncheon, sliced or roasted chicken";3740;Deli and cured meat sandwiches
27540120;Chicken salad sandwich on white;"bread, bun or roll; turkey; cheese";3704;Chicken fillet sandwiches
27540121;Chicken salad sandwich on wheat;"bread, bun or roll; multigrain, whole grain, whole wheat; turkey; cheese";3704;Chicken fillet sandwiches
27540122;Chicken salad sandwich wrap;"tortilla; flatbread; turkey; cheese";3704;Chicken fillet sandwiches
27540123;Club sandwich on white;"bread, bun or roll; turkey, chicken or other meats";3740;Deli and cured meat sandwiches
27540124;Club sandwich on white, with cheese;"bread, bun or roll; turkey, chicken or other meats";3740;Deli and cured meat sandwiches
27540125;Club sandwich on wheat;"bread, bun or roll; multigrain, whole grain, whole wheat; turkey, chicken or other meats";3740;Deli and cured meat sandwiches
27540126;Club sandwich on wheat, with cheese;"bread, bun or roll; multigrain, whole grain, whole wheat; turkey, chicken or other meats";3740;Deli and cured meat sandwiches
27540127;Club sandwich or sub, restaurant;"fast food; bread, bun or roll; turkey, chicken or other meats; cheese";3740;Deli and cured meat sandwiches
27540130;Barbecue chicken sandwich, on white bun;"bbq; on bread or roll; shredded or pulled; NS as to grain; turkey";3742;Meat and BBQ sandwiches
27540131;Barbecue chicken sandwich, on wheat bun;"bbq; on bread or roll; shredded or pulled; multigrain, whole grain, or whole wheat; turkey";3742;Meat and BBQ sandwiches
27540132;Chicken fillet sandwich, NFS;chicken patty;3704;Chicken fillet sandwiches
27540139;Chicken fillet sandwich, from school cafeteria;chicken patty;3704;Chicken fillet sandwiches
27540145;Chicken fillet biscuit, from fast food;homemade or other place;3704;Chicken fillet sandwiches
27540146;Chicken fillet sandwich, fried, from fast food;"patty; crispy; breaded; on bun, bread or roll";3704;Chicken fillet sandwiches
27540147;Chicken fillet sandwich, fried, from fast food, with cheese;"patty; crispy; breaded; on bun, bread or roll; NS as to cheese";3704;Chicken fillet sandwiches
27540152;Chicken fillet sandwich, grilled, from fast food;"patty; on bun, bread or roll";3704;Chicken fillet sandwiches
27540153;Chicken fillet sandwich, grilled, from fast food, with cheese;"patty; on bun, bread or roll; NS as to cheese";3704;Chicken fillet sandwiches
27540160;Chicken fillet sandwich, NS as to fried or grilled, from fast food;"patty; on bun, bread or roll; with or without cheese";3704;Chicken fillet sandwiches
27540175;Chicken fillet sandwich, fried, on white bun;"patty; crispy; breaded; on bread or roll; NS as to grain";3704;Chicken fillet sandwiches
27540176;"Chicken fillet sandwich, fried, on white bun; with cheese";"patty; crispy; breaded; on bread or roll; NS as to grain; NS as to cheese";3704;Chicken fillet sandwiches
27540185;Chicken fillet sandwich, fried, on wheat bun;"patty; crispy; breaded; on bread or roll; multigrain, whole grain, or whole wheat";3704;Chicken fillet sandwiches
27540186;Chicken fillet sandwich, fried, on wheat bun, with cheese;"patty; crispy; breaded; on bread or roll; multigrain, whole grain, or whole wheat; NS as to cheese";3704;Chicken fillet sandwiches
27540195;Chicken fillet sandwich, grilled, on white bun;"patty; on bread or roll; NS as to grain";3704;Chicken fillet sandwiches
27540196;Chicken fillet sandwich, grilled, on white bun, with cheese;"patty; on bread or roll; NS as to grain; NS as to cheese";3704;Chicken fillet sandwiches
27540205;Chicken fillet sandwich, grilled, on wheat bun;"patty; on bread or roll; multigrain, whole grain, or whole wheat";3704;Chicken fillet sandwiches
27540206;Chicken fillet sandwich, grilled, on wheat bun, with cheese;"patty; on bread or roll; multigrain, whole grain, or whole wheat; NS as to cheese";3704;Chicken fillet sandwiches
27540210;Chicken fillet wrap sandwich, fried, from fast food;"patty; crispy; breaded; on tortilla; with or without cheese; homemade or other place; NS as to fried or grilled";3704;Chicken fillet sandwiches
27540300;Chicken fillet wrap sandwich, grilled, from fast food;"patty; on tortilla; with or without cheese; homemade or other place";3704;Chicken fillet sandwiches
27545100;Turkey or chicken burger, on white bun;"homemade; bun, NFS";3702;Burgers
27545110;Turkey or chicken burger, on wheat bun;"homemade; any size patty";3702;Burgers
27550000;Fish sandwich, fried, from fast food;"fillet; crispy; breaded";3730;Seafood sandwiches
27550100;Fish sandwich, fried, from fast food, with cheese;"fillet; crispy; breaded; NS as to cheese; McDonalds Fish sandwich";3730;Seafood sandwiches
27550110;Crab cake sandwich;"soft shell crab; shrimp cake";3730;Seafood sandwiches
27550120;Salmon cake sandwich;tuna cake;3730;Seafood sandwiches
27550150;Fried seafood sandwich;"oyster; shrimp; clams; poor boy";3730;Seafood sandwiches
27550200;Fish sandwich, from school cafeteria;fillet;3730;Seafood sandwiches
27550300;Fish sandwich, NFS;fillet;3730;Seafood sandwiches
27550400;Fish sandwich, fried, on white bun;"fillet; crispy; breaded; on bread or roll";3730;Seafood sandwiches
27550405;Fish sandwich, fried, on white bun, with cheese;"fillet; crispy; breaded; on bread or roll; NS as to cheese";3730;Seafood sandwiches
27550410;Fish sandwich, fried, on wheat bun;"fillet; crispy; breaded; on bread or roll; multigrain; whole grain; whole wheat";3730;Seafood sandwiches
27550415;Fish sandwich, fried, on wheat bun, with cheese;"fillet; crispy; breaded; on bread or roll; multigrain; whole grain; whole wheat; NS as to cheese";3730;Seafood sandwiches
27550420;Fish sandwich, grilled;"fillet; broiled; with or without cheese";3730;Seafood sandwiches
27550425;Fish wrap sandwich;"fillet; tortilla; with or without cheese";3730;Seafood sandwiches
27550510;Sardine sandwich;;3730;Seafood sandwiches
27550720;Tuna salad sandwich on white;"tuna fish; bread, bun or roll";3730;Seafood sandwiches
27550730;Tuna salad sandwich on white, with cheese;"tuna melt; tuna fish; bread, bun or roll";3730;Seafood sandwiches
27550735;Tuna salad sandwich on wheat;"tuna fish; bread, bun or roll; multigrain, whole grain, whole wheat";3730;Seafood sandwiches
27550737;Tuna salad sandwich on wheat, with cheese;"tuna fish; tuna melt; bread, bun or roll; multigrain, whole grain, whole wheat";3730;Seafood sandwiches
27550755;Tuna salad sandwich wrap;"tuna fish; tortilla; flatbread; cheese";3730;Seafood sandwiches
27550800;Seafood salad sandwich;"crab salad; shrimp salad; lobster salad";3730;Seafood sandwiches
27560130;Bologna sandwich on white;bread, bun or roll;3740;Deli and cured meat sandwiches
27560140;Bologna sandwich on white, with cheese;bread, bun or roll;3740;Deli and cured meat sandwiches
27560150;Bologna sandwich on wheat;"bread, bun or roll; multigrain, whole grain, whole wheat";3740;Deli and cured meat sandwiches
27560160;Bologna sandwich on wheat, with cheese;"bread, bun or roll; multigrain, whole grain, whole wheat";3740;Deli and cured meat sandwiches
27560300;Corn dog;;3703;Frankfurter sandwiches
27560350;Pig in a blanket;dough wrapped hot dog;3703;Frankfurter sandwiches
27560520;Salami sandwich on white;"bread, bun or roll; pepperoni";3740;Deli and cured meat sandwiches
27560530;Salami sandwich on white, with cheese;"bread, bun or roll; pepperoni";3740;Deli and cured meat sandwiches
27560540;Salami sandwich on wheat;"bread, bun or roll; multigrain, whole grain, whole wheat; pepperoni";3740;Deli and cured meat sandwiches
27560550;Salami sandwich on wheat, with cheese;"bread, bun or roll; multigrain, whole grain, whole wheat; pepperoni";3740;Deli and cured meat sandwiches
27560610;Italian sandwich on white;"bread, bun or roll; cheese";3740;Deli and cured meat sandwiches
27560620;Italian sandwich on wheat;"bread, bun or roll; multigrain, whole grain, whole wheat; cheese";3740;Deli and cured meat sandwiches
27560630;Italian sandwich or sub, restaurant;"fast food; bread, bun or roll; cheese";3740;Deli and cured meat sandwiches
27560710;Italian sausage sandwich on white;"bread, bun or roll; bratwurst, chorizo, kielbasa, Polish";3703;Frankfurter sandwiches
27560715;Italian sausage sandwich on wheat;"bread, bun or roll; multigrain, whole grain, whole wheat; bratwurst, chorizo, kielbasa, Polish";3740;Deli and cured meat sandwiches
27560920;Spam sandwich;;3740;Deli and cured meat sandwiches
27564000;Hot dog sandwich, NFS, on white bun;;3703;Frankfurter sandwiches
27564001;Hot dog sandwich, NFS, on wheat bun;multigrain, whole grain, whole wheat;3703;Frankfurter sandwiches
27564010;Hot dog sandwich, NFS, on white bread;;3703;Frankfurter sandwiches
27564020;Hot dog sandwich, NFS, on wheat bread;multigrain, whole grain, whole wheat;3703;Frankfurter sandwiches
27564060;Hot dog sandwich, beef, on white bun;;3703;Frankfurter sandwiches
27564061;Hot dog sandwich, beef, on wheat bun;multigrain, whole grain, whole wheat;3703;Frankfurter sandwiches
27564070;Hot dog sandwich, beef, on white bread;;3703;Frankfurter sandwiches
27564080;Hot dog sandwich, beef, on wheat bread;multigrain, whole grain, whole wheat;3703;Frankfurter sandwiches
27564180;Hot dog sandwich, meat and poultry, on white bun;"regular; pork";3703;Frankfurter sandwiches
27564181;Hot dog sandwich, meat and poultry, on wheat bun;"regular; pork; multigrain, whole grain, whole wheat";3703;Frankfurter sandwiches
27564190;Hot dog sandwich, meat and poultry, on white bread;"regular; pork";3703;Frankfurter sandwiches
27564200;Hot dog sandwich, meat and poultry, on wheat bread;"regular; pork; multigrain, whole grain, whole wheat";3703;Frankfurter sandwiches
27564240;Hot dog sandwich, turkey, on white bun;chicken;3703;Frankfurter sandwiches
27564241;Hot dog sandwich, turkey, on wheat bun;"chicken; multigrain, whole grain, whole wheat";3703;Frankfurter sandwiches
27564250;Hot dog sandwich, turkey, on white bread;chicken;3703;Frankfurter sandwiches
27564260;Hot dog sandwich, turkey, on wheat bread;"chicken; multigrain, whole grain, whole wheat";3703;Frankfurter sandwiches
27564300;Hot dog sandwich, reduced fat, on white bun;"fat free; reduced sodium";3703;Frankfurter sandwiches
27564301;Hot dog sandwich, reduced fat, on wheat bun;"fat free; reduced sodium; multigrain, whole grain, whole wheat";3703;Frankfurter sandwiches
27564310;Hot dog sandwich, reduced fat, on white bread;"fat free; reduced sodium";3703;Frankfurter sandwiches
27564320;Hot dog sandwich, reduced fat, on wheat bread;"fat free; reduced sodium; multigrain, whole grain, whole wheat";3703;Frankfurter sandwiches
27564420;Hot dog sandwich, vegetarian, on bun;"any type of bun; tofu dog";3703;Frankfurter sandwiches
27564430;Hot dog sandwich, vegetarian, on bread;"any type of bread; tofu dog";3703;Frankfurter sandwiches
27564440;Chili hot dog sandwich, on white bun;;3703;Frankfurter sandwiches
27564441;Chili hot dog sandwich, on wheat bun;multigrain, whole grain, whole wheat;3703;Frankfurter sandwiches
27564450;Chili hot dog sandwich, on white bread;;3703;Frankfurter sandwiches
27564460;Chili hot dog sandwich, on wheat bread;multigrain, whole grain, whole wheat;3703;Frankfurter sandwiches
27580010;Multiple meat sandwich on white;"bread, bun or roll; any two or more meats excluding bacon";3740;Deli and cured meat sandwiches
27580020;Multiple meat sandwich on white, with cheese;"bread, bun or roll; any two or more meats excluding bacon";3740;Deli and cured meat sandwiches
